{
  "review_id": "m050-source-grounded-crosswalk-hold",
  "review_version": "1.0.0",
  "case_family_id": "m050",
  "candidate_universe_resource": "resources/case-families/full-200-rich-candidate-universes.v1.1.json",
  "source_record_ids": [
    "m050-donor-identity-access-natural-concise-v1",
    "m050-donor-identity-access-natural-detailed-v1"
  ],
  "status": "hold",
  "reason_codes": [
    "combined-neutral-positions",
    "granularity-mismatch"
  ],
  "issues": [
    {
      "source_role": "expert",
      "source_candidate_id": "exp2",
      "related_neutral_candidate_ids": [
        "c03",
        "c04",
        "c07"
      ],
      "explanation": "Combines identity terms, medical-information access, and re-identification warning."
    },
    {
      "source_role": "framework",
      "source_candidate_id": "fw3",
      "related_neutral_candidate_ids": [
        "c03",
        "c04"
      ],
      "explanation": "Combines anonymity limits with continuing medical-information exchange."
    }
  ],
  "next_action": "Build a successor projection at one identity/medical-information policy dimension.",
  "reviewed_at": "2026-08-30",
  "notes": "Historical represented records remain unchanged. Hold applies only to claiming a one-to-one historical crosswalk onto neutral resource v1.1.0."
}
