{
  "review_id": "m146-source-grounded-crosswalk-hold",
  "review_version": "1.0.0",
  "case_family_id": "m146",
  "candidate_universe_resource": "resources/case-families/full-200-rich-candidate-universes.v1.1.json",
  "source_record_ids": [
    "m146-ambient-ai-documentation-consent-natural-concise-v1",
    "m146-ambient-ai-documentation-consent-natural-detailed-v1"
  ],
  "status": "hold",
  "reason_codes": [
    "combined-neutral-positions",
    "granularity-mismatch"
  ],
  "issues": [
    {
      "source_role": "framework",
      "source_candidate_id": "fw3",
      "related_neutral_candidate_ids": [
        "c03",
        "c06"
      ],
      "explanation": "Combines recording retention, secondary training, and sensitive-encounter consent safeguards."
    }
  ],
  "next_action": "Separate capture/consent, retention, and secondary-training decisions.",
  "reviewed_at": "2026-08-30",
  "notes": "Historical represented records remain unchanged. Hold applies only to claiming a one-to-one historical crosswalk onto neutral resource v1.1.0."
}
