{
  "review_id": "m123-source-grounded-crosswalk-hold",
  "review_version": "1.0.0",
  "case_family_id": "m123",
  "candidate_universe_resource": "resources/case-families/full-200-rich-candidate-universes.v1.1.json",
  "source_record_ids": [
    "m123-wastewater-surveillance-consent-resolution-natural-concise-v1",
    "m123-wastewater-surveillance-consent-resolution-natural-detailed-v1"
  ],
  "status": "hold",
  "reason_codes": [
    "combined-neutral-positions",
    "granularity-mismatch"
  ],
  "issues": [
    {
      "source_role": "public",
      "source_candidate_id": "pub2",
      "related_neutral_candidate_ids": [
        "c02",
        "c05"
      ],
      "explanation": "Combines substantive surveillance restriction with community authorization."
    },
    {
      "source_role": "expert",
      "source_candidate_id": "exp1",
      "related_neutral_candidate_ids": [
        "c01",
        "c03",
        "c05"
      ],
      "explanation": "Combines permission, privacy/resolution thresholds, and community review."
    },
    {
      "source_role": "framework",
      "source_candidate_id": "fw3",
      "related_neutral_candidate_ids": [
        "c03",
        "c05"
      ],
      "explanation": "Combines necessity/proportionality with community authorization."
    }
  ],
  "next_action": "Build successor projections at one policy dimension or an explicit expanded governance projection.",
  "reviewed_at": "2026-08-30",
  "notes": "Historical represented records remain unchanged. Hold applies only to claiming a one-to-one historical crosswalk onto neutral resource v1.1.0."
}
