{
  "review_id": "m042-source-grounded-crosswalk-hold",
  "review_version": "1.0.0",
  "case_family_id": "m042",
  "candidate_universe_resource": "resources/case-families/full-200-rich-candidate-universes.v1.1.json",
  "source_record_ids": [
    "m042-prenatal-screening-disability-justice-natural-concise-v1",
    "m042-prenatal-screening-disability-justice-natural-detailed-v1"
  ],
  "status": "hold",
  "reason_codes": [
    "combined-neutral-positions",
    "granularity-mismatch"
  ],
  "issues": [
    {
      "source_role": "public",
      "source_candidate_id": "pub2",
      "related_neutral_candidate_ids": [
        "c02",
        "c04"
      ],
      "explanation": "Combines opt-in architecture with disability/lived-experience content."
    },
    {
      "source_role": "framework",
      "source_candidate_id": "fw2",
      "related_neutral_candidate_ids": [
        "c02",
        "c04",
        "c06"
      ],
      "explanation": "Combines opt-in, disability-inclusive counseling, and anti-stigma program concerns."
    }
  ],
  "next_action": "Separate consent default, disability information, and program-level anti-stigma Policies.",
  "reviewed_at": "2026-08-30",
  "notes": "Historical represented records remain unchanged. Hold applies only to claiming a one-to-one historical crosswalk onto neutral resource v1.1.0."
}
