{
  "review_id": "m141-source-grounded-crosswalk-hold",
  "review_version": "1.0.0",
  "case_family_id": "m141",
  "candidate_universe_resource": "resources/case-families/full-200-rich-candidate-universes.v1.1.json",
  "source_record_ids": [
    "m141-commercial-health-data-partnership-natural-concise-v1",
    "m141-commercial-health-data-partnership-natural-detailed-v1"
  ],
  "status": "hold",
  "reason_codes": [
    "combined-neutral-positions",
    "granularity-mismatch"
  ],
  "issues": [
    {
      "source_role": "expert",
      "source_candidate_id": "exp2",
      "related_neutral_candidate_ids": [
        "c04",
        "c06"
      ],
      "explanation": "Combines public-benefit aim with commercial value return."
    },
    {
      "source_role": "expert",
      "source_candidate_id": "exp1",
      "related_neutral_candidate_ids": [
        "c01",
        "c07"
      ],
      "explanation": "Combines controlled public-benefit access with governance safeguards."
    }
  ],
  "next_action": "Separate permission/public benefit from commercial value-sharing and governance.",
  "reviewed_at": "2026-08-30",
  "notes": "Historical represented records remain unchanged. Hold applies only to claiming a one-to-one historical crosswalk onto neutral resource v1.1.0."
}
