{
  "review_id": "m034-source-grounded-crosswalk-hold",
  "review_version": "1.0.0",
  "case_family_id": "m034",
  "candidate_universe_resource": "resources/case-families/full-200-rich-candidate-universes.v1.1.json",
  "source_record_ids": [
    "m034-canh-prolonged-disorder-consciousness-concise-v1",
    "m034-canh-prolonged-disorder-consciousness-detailed-v1"
  ],
  "status": "hold",
  "reason_codes": [
    "combined-neutral-positions",
    "candidate-not-represented"
  ],
  "issues": [
    {
      "source_role": "expert",
      "source_candidate_id": "exp1",
      "related_neutral_candidate_ids": [
        "c01",
        "c02",
        "c06"
      ],
      "explanation": "Umbrella deliberation procedure spans separate continuation, withdrawal, and review Policies."
    }
  ],
  "next_action": "Define a successor expert projection at one operative granularity.",
  "reviewed_at": "2026-08-30",
  "notes": "Historical represented records remain unchanged. Hold applies only to claiming a one-to-one historical crosswalk onto neutral resource v1.1.0."
}
